2024-2025 Dual Enrollment Course-High School Subject Area Equivalency List,
PHY,X001,Technical Phys (Single Course Overview),0.5,EQ,,Science
PHY,X001/L,Technical Phys (Single Course Overview),1,EQ,,Science
PHY,X004,Technical Phys I (Multiple Course Overview),0.5,EQ,,Science
PHY,X004/L,Technical Phys I (Multiple Course Overview),1,EQ,,Science
PHY,X005,Tech Physics II (Multiple Course Seq.),0.5,EQ,,Science
PHY,X005/L,Tech Physics II (Multiple Course Seq.),1,EQ,,Science
PHY,X007,Physics for Health Related Technologies,0.5,EQ,,Science
PHY,X007/L,Physics for Health Related Technologies,1,EQ,,Science
,,,2024-2025 Academic Dual Enrollment - High School Dubject Area Equivalency List,,,,,
PHY,X007C,Physics for Health Related Technologies,,1,EQ,,,Science
PHY,X020,Fundamentals of Physics (GE Core),,0.5,EQ,Natural Science,,Science
PHY,X020/L,Fundamentals of Physics (GE Core),,1,EQ,Natural,Science,Science
PHY,X020C,Fundamentals of Physics (GE Core),,1,EQ,Natural Science,,Science
PHY,X023,Survey of General Physics,,0.5,EQ,,,Science
PHY,X025,Basic Physics (One Semester),,0.5,EQ,,,Science
PHY,X025/L,Basic Physics (One Semester),,1,EQ,,,Science
PHY,X044,Physics for Engineers II,,0.5,EQ,,,Science
PHY,X048,General Physics W/Calculus I (2 Sem Seq.) (GE Core),,0.5,EQ,Natural Science,,Science
PHY,X048/L,General Physics W/Calculus I (2 Sem Seq.) (GE,Core),1,EQ,Natural,Science,Science
PHY,X048C,General Physics W/Calculus I (2 Sem Seq.) (GE Core),,1,EQ,Natural Science,,Science
PHY,X049,General Physics W/Calculus II (2 Sem Seq.),,0.5,EQ,,,Science
PHY,X049/L,General Physics W/Calculus II (2 Sem Seq.),,1,EQ,,,Science
PHY,X049C,General Physics W/Calculus II (2 Sem Seq.),,1,EQ,,,Science
PHY,X053,General Physics I (2 Sem Seq) (GE Core),,0.5,EQ,Natural Science,,Science
PHY,X053/L,General Physics I (2 Sem Seq) (GE Core),,1,EQ,Natural,Science,Science
PHY,X053C,General Physics I (2 Sem Seq) (GE Core),,1,EQ,Natural,Science,Science
PHY,X054,General Physics II (2 Sem Seq),,0.5,EQ,,,Science
PHY,X054/L,General Physics II (2 Sem Seq),,1,EQ,,,Science
PHY,X054C,General Physics II (2 Sem Seq),,1,EQ,,,Science
PHY,X101,Elements of Modern Physics,,0.5,EQ,,,Science
PHY,X101/L,Elements of Modern Physics,,1,EQ,,,Science
PHY,X101C,Elements of Modern Physics,,1,EQ,,,Science
POR,X120,"Elementary Portuguese I, Concentrated",,1,EL,,,World Languages
POR,X121,"Elementary Portuguese II, Concentrated",,1,EL,,,World Languages
POR,X130,Elementary Accelerated Portuguese,,1,EL,,,World Languages
POR,X131,Elem Accelerated Course I,,1,EL,,,World Languages
POR,X140,Portuguese for Spanish Speakers I,,0.5,EL,,,World Languages
POR,X141,Portuguese for Advanced Students of Spanish II,,0.5,EL,,,World Languages
POR,X200,Intm Lang: Gen Rev Basic Skills I,,0.5,EL,,,World Languages
POR,X201,Intm Lang: Gen Rev Basic Skills II,,0.5,EL,,,World Languages
POR,X202,Intermediate Portuguese Language I- Upper,,0.5,EL,,,World Languages
POR,X220,Intermediate Portuguese Reading and Conversation I,,1,EL,,,World Languages
POS,X041,American Government 1 (GE Core),,0.5,AG,Social Sciences,,Social Studies
POS,X112,State and Local Governments,,0.5,EL,,,Electives
PSB,X000,Basic Psychobiology,,0.5,EQ,,,Science
PSB,X002,Intro to Psychobiology,,0.5,EQ,,,Science
PSC,X001,Ideas and Philosophy of Science,,0.5,EQ,,,Science
PSC,X001C,Ideas and Philosophy of Science,,1,EQ,,,Science
PSC,X121,Topics in Physical Science,,0.5,EQ,,,Science
PSC,X121/L,Topics in Physical Science,,1,EQ,,,Science
PSC,X121C,Topics in Physical Science,,1,EQ,,,Science
PSC,X341,Fundamentals of Physics & Chemistry I,,0.5,EQ,,,Science
PSC,X341/L,Fundamentals of Physics & Chemistry I,,1,EQ,,,Science
PSC,X341C,Fundamental of Physics & Chemistry I,,1,EQ,,,Science
PSY,X012,Introduction to Psychology (L) (GE Core),,0.5,EL,Social Sciences,,Electives
QMB,X001,Business Mathematics,,0.5,MA,,,Mathematics
QMB,X100,Basic Business Statistics,,1,MA,,,Mathematics
QMB,X600,Introduction to Management Science,,1,MA,,,Mathematics
REA,X505,Vocabulary,,0.5,EL,,,Electives
REL,X300,World Religions,,0.5,EL,,,Electives
RTV,X201,Fundamentals of Broadcast Production (L),,0.5,PF,,,Performing/Fine Arts/Speech and Debate/Career and Technical Education
RTV,X300,Broadcast News,,0.5,PF,,,Performing/Fine Arts/Speech and Debate/Career and Technical Education
RUS,X104,Beginning Russian 3,,0.5,EL,,,World Languages
RUS,X120,"Elementary Russian I, Concentrated",,1,EL,,,World Languages
RUS,X121,"Elementary Russian II, Concentrated",,1,EL,,,World Languages
,,2024-2025 Academic Dual Enrollment - High School Dubject Area Equivalency List,,,,
RUS,X130,Elementary Russian I- Accelerated,1,EL,,World Languages
RUS,X131,Elementary Russian II- Accelerated,1,EL,,World Languages
RUS,X200,Intermediate Russian I,0.5,EL,,World Languages
RUS,X201,Intermediate Russian II,0.5,EL,,World Languages
RUS,X220,Intermediate Russian Reading and Conversation I,1,EL,,World Languages
RUS,X221,Intermediate Russian Reading and Conversation II,1,EL,,World Languages
RUS,X240,Intermediate Conversation I,0.5,EL,,World Languages
RUS,X241,Intermediate Conversation II,0.5,EL,,World Languages
SLS,X001,Prep Student Development,0.5,EL,,Electives
SLS,X101,Orientation to the Inst & Its Resources,0.5,EL,,Electives
SLS,X103,Living and Learning in a Knowledge Based Environment,0.5,EL,,Electives
SLS,X106,First Year Experience Orientation,0.5,EL,,Electives
SLS,X122,Combo: Orientation/Personal-Social Dev,0.5,EL,,Electives
SLS,X261,General Leadership,0.5,EL,,Electives
SLS,X301,Career Development Comprehensive,0.5,EL,,Electives
SLS,X501,College Study Skills 1,0.5,EL,,Electives
SLS,X510,Preparing for Student Success,0.5,EL,,Electives
SLS,X515,Cornerstone Experience,0.5,EL,,Electives
SPC,X17,Fundamentals of Speech (L),0.5,PF,,Performing/Fine Arts/Speech and Debate/Career and Technical Education
SPC,X23,Fundamentals of Speech,0.5,PF,,Performing/Fine Arts/Speech and Debate/Career and Technical Education
SPC,X24,Pub Speaking Gr Disc Interpsnl & List,0.5,PF,,Performing/Fine Arts/Speech and Debate/Career and Technical Education
SPC,X300,Fundamentals of Interpersonal Com,0.5,PF,,Performing/Fine Arts/Speech and Debate/Career and Technical Education
SPC,X511,Argumentation and Debate,0.5,PF,,Performing/Fine Arts/Speech and Debate/Career and Technical Education
SPC,X541,Persuasion,0.5,PF,,Performing/Fine Arts/Speech and Debate/Career and Technical Education
SPC,X600,Public Speaking,0.5,PF,,Performing/Fine Arts/Speech and Debate/Career and Technical Education
SPC,X603,Public Speaking and Group Discussions,0.5,PF,,Performing/Fine Arts/Speech and Debate/Career and Technical Education
SPC,X608,Public Speaking (L),0.5,PF,,Performing/Fine Arts/Speech and Debate/Career and Technical Education
SPC,X65,Communication in Business (L),0.5,PF,,Performing/Fine Arts/Speech and Debate/Career and Technical Education
SPN,X000,Basic Oral Expression I,0.5,EL,,World Languages
SPN,X001,Beginning Oral Expression II,0.5,EL,,World Languages
SPN,X100,Elementary Spanish I,0.5,EL,,World Languages
SPN,X101,Elementary Spanish II,0.5,EL,,World Languages
SPN,X120,"Elementary Spanish I, Concentrated",1,EL,,World Languages
SPN,X121,"Elementary Spanish II, Concentrated",1,EL,,World Languages
SPN,X125,Spanish 3,1,EL,,World Languages
SPN,X130,Elementary Spanish I Accelerated,1,EL,,World Languages
SPN,X131,Elementary Spanish II Accelerated,1,EL,,World Languages
SPN,X200,Intm Level: Gen Rev Basic Skills I,0.5,EL,,World Languages
SPN,X201,Intm Level: Gen Rev Basic Skills II,0.5,EL,,World Languages
SPN,X220,Intermediate Reading and Conversation,1,EL,,World Languages
SPN,X221,Reading and Conversation II,1,EL,,World Languages
SPN,X230,Intermediate Reading I,1,EL,,World Languages
SPN,X231,Intermediate Reading II,1,EL,,World Languages
SPN,X233,Intermediate Reading in Spanish,0.5,EL,,World Languages
SPN,X240,Intermediate Conversation I,0.5,EL,,World Languages
SPN,X241,Intermediate Conversation II,0.5,EL,,World Languages
SPN,X242,Intermediate Spanish,0.5,EL,,World Languages
SPN,X300,Review Grammar and Syntax I,0.5,EL,,World Languages
SPN,X301,Review Grammar and Syntax II,0.5,EL,,World Languages
SPN,X340,Spanish for Speakers of Spanish,0.5,EL,,World Languages
SPN,X341,Spanish for Speakers of Spanish II,0.5,EL,,World Languages
SPN,X400,Conversation and Composition I,0.5,EL,,World Languages
STA,X001,General Education Statistics,0.5,MA,,Mathematics
STA,X013,Basic Descript. & Inferential Statistics,1,MA,,Mathematics
STA,X014,Descriptive and Inferential Statistics,1,MA,,Mathematics
STA,X023,Statistical Methods (GE Core),1,MA,Mathematics,Mathematics
,,2024-2025 Academic Dual Enrollment - High School Dubject Area Equivalency List,,,,
STA,X024,Introd. To Probability and Statistics II,1,MA,,Mathematics
STA,X032,Probability & Statistics for Engineering,1,MA,,Mathematics
STA,X037,Statistics with Calculus,1,MA,,Mathematics
STA,X111,Educational Statistics,1,MA,,Mathematics
STA,X122,Statistical Applic. in Social Science I,1,MA,,Mathematics
STA,X123,Statistical Applic. In Social Science II,1,MA,,Mathematics
STA,X173,Biostatistics,1,MA,,Mathematics
STA,X442,Probability,1,MA,,Mathematics
STA,X821,Stochastic Processes,1,MA,,Mathematics
STS,X300,Human Anatomy and Physiology,0.5,EQ,,Science
STS,X300C,Human Anatomy and Physiology,1,EQ,,Science
SWA,X130,Beginning Swahili 1,1,EL,,World Languages
SWA,X131,Beginning Swahili 2,1,EL,,World Languages
SWA,X200,Intermediate Swahili I,0.5,EL,,World Languages
SWA,X201,Intermediate Swahili II,0.5,EL,,World Languages
SYG,X000,Principles of Sociology,0.5,EL,,Electives
SYG,X010,Social Problems,0.5,EL,,Electives
SYG,X430,Marriage and Family,0.5,EL,,Electives
THE,X000,Theatre Appreciation (GE Core),0.5,PF,Humanities,Performing/Fine Arts/Speech and Debate/Career and Technical Education
THE,X010,Theatre Appreciation and History,0.5,PF,,Performing/Fine Arts/Speech and Debate/Career and Technical Education
THE,X011,Theatre Appreciation and History II,0.5,PF,,Performing/Fine Arts/Speech and Debate/Career and Technical Education
THE,X020,Introduction to Theatre,0.5,PF,,Performing/Fine Arts/Speech and Debate/Career and Technical Education
THE,X071,Intro to Cinema Arts,0.5,PF,,Performing/Fine Arts/Speech and Debate/Career and Technical Education
THE,X100,Introduction to Theatre History,0.5,PF,,Performing/Fine Arts/Speech and Debate/Career and Technical Education
THE,X300,Dramatic Literature,0.5,PF,,Performing/Fine Arts/Speech and Debate/Career and Technical Education
THE,X305,Survey of Dramatic Literature,0.5,PF,,Performing/Fine Arts/Speech and Debate/Career and Technical Education
THE,X925,Colloquiums/Symposiums/Workshops,0.5,PF,,Performing/Fine Arts/Speech and Debate/Career and Technical Education
TPA,X000,Introduction to Theatre Design,0.5,PF,,Performing/Fine Arts/Speech and Debate/Career and Technical Education
TPA,X210,Stagecraft I,0.5,PF,,Performing/Fine Arts/Speech and Debate/Career and Technical Education
TPA,X220,Intro to Stage Lighting,0.5,PF,,Performing/Fine Arts/Speech and Debate/Career and Technical Education
TPA,X231,Advanced Theatre Costuming,0.5,PF,,Performing/Fine Arts/Speech and Debate/Career and Technical Education
TPP,X100,Introduction to Acting I,0.5,PF,,Performing/Fine Arts/Speech and Debate/Career and Technical Education
TPP,X110,Acting I,0.5,PF,,Performing/Fine Arts/Speech and Debate/Career and Technical Education
TPP,X111,Acting II,0.5,PF,,Performing/Fine Arts/Speech and Debate/Career and Technical Education
TPP,X700,Intro to Voice,0.5,PF,,Performing/Fine Arts/Speech and Debate/Career and Technical Education
WOH,X001,Survey of World Civilizations,0.5,WH,,Social Studies
WOH,X012,World History I,0.5,WH,,Social Studies
WOH,X022,World History II,0.5,WH,,Social Studies
WOH,X023,Modern World History to 1815,0.5,WH,,Social Studies
WOH,X030,World History since 1815,0.5,WH,,Social Studies
Z00,X503,Intro to Comparative Animal Behavior,0.5,EQ,,Science
ZOO,X010,General Zoology I,0.5,EQ,,Science
ZOO,X010/L,General Zoology I,1,EQ,,Science
ZOO,X010C,General Zoology I,1,EQ,,Science
ZOO,X503C,Intro to Comparative Animal Behavior W/Lab,1,EQ,,Science
2024-2025 Dual Enrollment Course-High School Subject Area Equivalency,
The inclusion of career and technical education courses on this list does not guarantee that they are all appropriate for career dual enrollment.,
"Institutions must determine which of these, or any other career courses, meet the statutory requirements for career dual enrollment in Section",(s.)
"Career dual enrollment includes courses offered through career certificate (clock hour) programs and career associate degree programs (e.g., Associate",
"For college credit programs, postsecondary courses taken through dual enrollment for three credits or more that are part of a postsecondary",
"career/technical program of study (College Credit Certificate, Applied Technology Diploma, Associate in Applied Science, Associate of Science) shall be",
"For Career Certificate clock hour courses taken through dual enrollment, the following methodology must be used for the awarding of high school",
0.5 high school credit for each 75 hours in the course rounded down to the nearest 0.5 credits,
"for these courses is provided herein. If a course is not listed, one of the following may apply: 1) The course is not at least 75 clock hours or at least 3",
"college credit hours and cannot result in award of high school credit, 2) the course is not eligible for dual enrollment because it does not lead to an",
"industry certificate approved under sections 1008.44, F.S., or 3) the course is recently approved and has not been included in this table.",
The high school credits are awarded upon completion of the postsecondary course. Individual courses may be awarded more or less credit than is,
indicated on the list based upon the number of hours of which a course is taught at a Florida College System institution. Clock hour courses offered in,
Students seeking to meet the requirements of the Gold Seal Vocational Scholarship through dual enrollment must carefully choose courses that meet,
For those career and technical secondary courses that have been identified as satisfying the fine or performing arts high school graduation requirement,
,,2024-2025 Career Dual Enrollment - High School Dubject Area Equivalency List,,
Course Prefix,Course Number,Course Title,H.S. Credit,Discipline
ACO,40,Accounting Clerk OCP B (300 hours),2,Finance
ACO,41,Accounting Associate OCP C (300 hours),2,Finance
ACO,42,Accounting Assistant OCP D (150 hours),1,Finance
ACR,0,Overview of Air Conditioning (PSAV),1.5,Architecture & Construction
ACR,1,A/C and Refrigeration Theory (1 of 2),1.5,Architecture & Construction
ACR,2,A/C and Refrigeration Theory (2 of 2),0.5,Architecture & Construction
ACR,8,Basic Refrigeration Skills,0.5,Architecture & Construction
ACR,9,"Install, Maintain and Repair Basic Air Conditioning Systems",0.5,Architecture & Construction
ACR,22,Domestic Refrigeration,0.5,Architecture & Construction
ACR,41,"A/C, Refrigeration and Heating Helper OCP A (250 hours)",1.5,Architecture & Construction
ACR,43,"A/C, Refrigeration and Heating Mechanic Assistant OCP B (250 hours)",1.5,Architecture & Construction
ACR,44,"A/C, Refrigeration and Heating Technician OCP B (350 hours)",2,Architecture & Construction
ACR,45,Refrigeration Mechanic OCP D (350 hours),2,Architecture & Construction
ACR,46,Refrigeration Technician OCP B (450 hours),3,Architecture & Construction
ACR,47,"A/C, Refrigeration and Heating Mechanic (1 of 2) OCP C (250 hours)",1.5,Architecture & Construction
ACR,49,"A/C, Refrigeration and Heating Mechanic (2 of 2) OCP A (250 hours)",1.5,Architecture & Construction
ACR,60,Load Calculations/Psychometrics,0.5,Architecture & Construction
ACR,61,Psychometrics,0.5,Architecture & Construction
ACR,84,Cooling Appliance Technician (350 hours),2,Architecture & Construction
ACR,100,Basic Electricity (PSAV),0.5,Architecture & Construction
ACR,106,Applied Electricity,1,Architecture & Construction
ACR,107,Electricity Circuitry for HVAC Single Phase,0.5,Architecture & Construction
ACR,122,Refrigeration & AC Components (PSAV),1,Architecture & Construction
ACR,205,Compressors,0.5,Architecture & Construction
ACR,575,Light Commercial Refrigeration Technician,0.5,Architecture & Construction
ACR,577,HVAC Service and Installation- Intro,0.5,Architecture & Construction
ACR,578,Commercial Heating & AC Advanced,0.5,Architecture & Construction
ACR,601,Heat Pumps (PSAV),0.5,Architecture & Construction
ACR,602,Heat Pump Technology,1,Architecture & Construction
ACR,608,Residential Heating Systems,0.5,Architecture & Construction
ACR,610,"Heat Pumps, Electric Heat, Gas/Oil Furnaces & Boilers",0.5,Architecture & Construction
ACR,621,Fossil Fuel and Electric Heat,0.5,Architecture & Construction
ACR,622,Servicing Fossil Fuel & Electric Heating,0.5,Architecture & Construction
ACR,700,Central Residential A/C,0.5,Architecture & Construction
ACR,701,HVAC Troubleshooting,1,Architecture & Construction
ACR,704,Intro to Refrigeration/AC,1,Architecture & Construction
ACR,705,Mechanical Systems,0.5,Architecture & Construction
ACR,741,Commercial Refrigeration (PSAV),0.5,Architecture & Construction
ACR,815,Advanced Service Practices,0.5,Architecture & Construction
ACR,850,Trouble Shooting,1,Architecture & Construction
ACR,0001C,A/C and Refrigeration Theory (1 of 2),0.5,Architecture & Construction
ACR,0001L,A/C and Refrigeration Theory (1 of 2),0.5,Architecture & Construction
ACR,0002C,A/C and Refrigeration Theory (2 of 2),0.5,Architecture & Construction
ACR,0002L,A/C and Refrigeration Theory (2 of 2),0.5,Architecture & Construction
ACR,0009C,"Install, Maintain and Repair Basic Air Conditioning Systems",0.5,Architecture & Construction
ACR,000C,Overview of Air Conditioning (PSAV),1.5,Architecture & Construction
ACR,0044C,"A/C, Refrigeration and Heating Technician OCP B (350 hours)",2,Architecture & Construction
ACR,0061C,Psychometrics,0.5,Architecture & Construction
,,2024-2025 Career Dual Enrollment - High School Dubject Area Equivalency List,,
ACR,0100C,Basic Electricity (PSAV),0.5,Architecture & Construction
ACR,0205C,Compressors,0.5,Architecture & Construction
ACR,022C,Domestic Refrigeration,0.5,Architecture & Construction
ACR,0601C,Heat Pumps (PSAV),0.5,Architecture & Construction
ACR,0610C,"Heat Pumps, Electric Heat, Gas/Oil Furnaces & Boilers",0.5,Architecture & Construction
ACR,0741C,Commercial Refrigeration (PSAV),0.5,Architecture & Construction
ACR,0815C,Advanced Service Practices,0.5,Architecture & Construction
ACR,0850C,Trouble Shooting,1,Architecture & Construction
ACR,X067,Heating & Cooling Load Calculations (L),0.5,Architecture & Construction
ACR,X071,Business Management/Entrepreneurship,0.5,Architecture & Construction
ACR,X101,Applied Electricity (1 of 2),0.5,Architecture & Construction
ACR,X102,Applied Electricity (2 of 2),0.5,Architecture & Construction
ACR,X102C,Applied Electricity (2 of 2),0.5,Architecture & Construction
ACR,X103,Basic Electricity: Second Course,0.5,Architecture & Construction
ACR,X112,Basic Electricity for A/C and Refrigeration (L),0.5,Architecture & Construction
ACR,X113,Applied Electricity II (L),0.5,Architecture & Construction
ACR,X611,Applied Heating (L),0.5,Architecture & Construction
ACR,X740,Components of Refrigeration (L),0.5,Architecture & Construction
AER,10,Basic Skills and Safety (PSAV),1.5,"Transportation, Distribution & Logistics"
AER,11,Automotive Maintenance Technician OCP A (400 hours),2.5,"Transportation, Distribution & Logistics"
AER,14,Automotive Services Assistor OCP A (300 hours),2,"Transportation, Distribution & Logistics"
AER,26,Maintenance and Light Repair Technician 2,1,"Transportation, Distribution & Logistics"
AER,27,Maintenance and Light Repair Technician 3,1,"Transportation, Distribution & Logistics"
AER,28,Maintenance and Light Repair Technician 4,1,"Transportation, Distribution & Logistics"
AER,75,Introduction to Automotive Service Advisor (75 hours),0.5,"Transportation, Distribution & Logistics"
AER,76,Introduction to Automotive Customer Service (75 hours),0.5,"Transportation, Distribution & Logistics"
AER,77,Dealership Policies and Protocols,0.5,"Transportation, Distribution & Logistics"
AER,81,Introduction to Auto Body (L) OCP B (150 hours),0.5,"Transportation, Distribution & Logistics"
AER,110,Engine Repair Technician,1,"Transportation, Distribution & Logistics"
AER,118,Advanced Engine Repair Technician OCP B (200 hours),1,"Transportation, Distribution & Logistics"
AER,172,Automotive Heating and Air Conditioning OCP H (150 hours),1,"Transportation, Distribution & Logistics"
AER,173,Advanced Automotive Heating and Air Conditioning OCP H (200 hours),1,"Transportation, Distribution & Logistics"
AER,190,"Combination: Brakes, AC, Trains, Axles",0.5,"Transportation, Distribution & Logistics"
AER,198,Engine Mechanical Service & Repair (L),0.5,"Transportation, Distribution & Logistics"
AER,199,Engine Repair (PSAV),1,"Transportation, Distribution & Logistics"
AER,257,Automatic Transmission/Transaxle Technician OCP C (150 hours),1,"Transportation, Distribution & Logistics"
AER,258,Advanced Automatic Transmission and Transaxle Technician OCP C (200 hours),1,"Transportation, Distribution & Logistics"
AER,274,Manual Drivetrain and Axle Technician OCP D (150 hours),1,"Transportation, Distribution & Logistics"
AER,275,Advance Manual Drivetrain and Axle Technician OCP D (200 hours),1,"Transportation, Distribution & Logistics"
AER,299,Automatic Transmission and Transaxles (PSAV),1,"Transportation, Distribution & Logistics"
AER,319,Advanced Automotive Electrical/Electronic System Technician OCP G (400 hours),2.5,"Transportation, Distribution & Logistics"
AER,360,Automotive Electrical/Electronics Systems Technician OCP G (300 hours),2,"Transportation, Distribution & Logistics"
AER,398,Manual Transmissions and Drivelines (L),0.5,"Transportation, Distribution & Logistics"
AER,399,Auto Manual Transmission/Transaxles (PSAV),1,"Transportation, Distribution & Logistics"
AER,418,Automotive Brake System Technician OCP F (150 hours),1,"Transportation, Distribution & Logistics"
AER,419,Advanced Automotive Brake System Technician OCP F (200 hours),1,"Transportation, Distribution & Logistics"
AER,450,Automobile Suspension and Steering Technician,0.5,"Transportation, Distribution & Logistics"
AER,453,Automotive Suspension and Steering Technician OCP E (150 hours),1,"Transportation, Distribution & Logistics"
AER,459,Advanced Automotive Suspension and Steering Technician OCP E (200 hours),1,"Transportation, Distribution & Logistics"
,,2024-2025 Career Dual Enrollment - High School Dubject Area Equivalency List,,
AER,498,Automotive Steering Suspension Systems (L),0.5,"Transportation, Distribution & Logistics"
AER,499,"Steering, Suspension & Alignment (PSAV)",1,"Transportation, Distribution & Logistics"
AER,503,Automotive Engine Performance Technician OCP I (300 hours),2,"Transportation, Distribution & Logistics"
AER,506,Advanced Automotive Engine Performance Technician OCP I (400 hours),2.5,"Transportation, Distribution & Logistics"
AER,599,L1 Auto Advanced Engine Performance Specialty ASE Test Prep,1,"Transportation, Distribution & Logistics"
AER,691,Electrical Systems (PSAV),1,"Transportation, Distribution & Logistics"
AER,692,Electrical/Electronic Systems II (PSAV),1,"Transportation, Distribution & Logistics"
AER,759,Automotive Service Technology II (PSAV),0.5,"Transportation, Distribution & Logistics"
AER,871,Automotive Compresses Natural Gas Technician (150 hours),1,"Transportation, Distribution & Logistics"
AER,875,Alternative Fuels Maintenance Technician (300 hours),2,"Transportation, Distribution & Logistics"
AER,876,Advanced Alternative Fuels Technician (300 hours),2,"Transportation, Distribution & Logistics"
AER,891,Engine Performance I (PSAV),1,"Transportation, Distribution & Logistics"
AER,892,Engine Performance II (PSAV),1,"Transportation, Distribution & Logistics"
AER,945,Dealership Internship,1,"Transportation, Distribution & Logistics"
AER,0014C,Automotive Services Assistor OCP A (300 hours),2,"Transportation, Distribution & Logistics"
AER,0021C,Automotive Service Assistor Core (PSAV),0.5,"Transportation, Distribution & Logistics"
AER,0110C,Engine Repair Technician,1,"Transportation, Distribution & Logistics"
AER,0172C,Automotive Heating and Air Conditioning OCP H (150 hours),1,"Transportation, Distribution & Logistics"
AER,0190C,"Combination: Brakes, AC, Trains, Axles",0.5,"Transportation, Distribution & Logistics"
AER,0190L,"Combination: Brakes, AC, Trains, Axles",0.5,"Transportation, Distribution & Logistics"
AER,0198C,Engine Mechanical Service & Repair (L),0.5,"Transportation, Distribution & Logistics"
AER,0199C,Engine Repair (PSAV),1,"Transportation, Distribution & Logistics"
AER,0257C,Automatic Transmission/Transaxle Technician OCP C (150 hours),1,"Transportation, Distribution & Logistics"
AER,0274C,Manual Drivetrain and Axle Technician OCP D (150 hours),1,"Transportation, Distribution & Logistics"
AER,0299C,Automatic Transmission and Transaxles (PSAV),1,"Transportation, Distribution & Logistics"
AER,0320L,Manual and Automatic Transmissions (PSAV),1,"Transportation, Distribution & Logistics"
AER,0360C,Automotive Electrical/Electronics Systems Technician OCP G (300 hours),2,"Transportation, Distribution & Logistics"
AER,0399C,Auto Manual Transmission/Transaxles (PSAV),1,"Transportation, Distribution & Logistics"
AER,0401L,Basic Hydraulics,1,"Transportation, Distribution & Logistics"
AER,0418C,Automotive Brake System Technician OCP F (150 hours),1,"Transportation, Distribution & Logistics"
AER,0453C,Automotive Suspension and Steering Technician OCP E (150 hours),1,"Transportation, Distribution & Logistics"
AER,0499C,"Steering, Suspension & Alignment (PSAV)",1,"Transportation, Distribution & Logistics"
AER,0503C,Automotive Engine Performance Technician OCP I (300 hours),2,"Transportation, Distribution & Logistics"
AER,0560L,Introduction to Automotive Technology and Braking Systems (PSAV),1,"Transportation, Distribution & Logistics"
